[
  {
    "annotationId": "e9ce232f-5a1c-4ea3-b603-f5d2dcc50182",
    "productId": "product_001",
    "imageId": "product_001_back",
    "source": "ocr_spatial_heuristic",
    "sourceLicense": "proprietary",
    "classId": 2,
    "className": "declaration_panel",
    "boundingBox": {
      "xCenter": 0.475,
      "yCenter": 0.455,
      "width": 0.25,
      "height": 0.21
    },
    "provenance": "weak_candidate",
    "verificationStatus": "PENDING",
    "reviewerId": null,
    "verifiedAt": null,
    "originalBoundingBox": null,
    "originalClassId": null,
    "reviewNotes": null,
    "trainingEligible": false
  },
  {
    "annotationId": "bd659e78-a616-4285-9c0f-dc69dba07d3c",
    "productId": "product_002",
    "imageId": "product_002_back",
    "source": "ocr_spatial_heuristic",
    "sourceLicense": "proprietary",
    "classId": 2,
    "className": "declaration_panel",
    "boundingBox": {
      "xCenter": 0.475,
      "yCenter": 0.455,
      "width": 0.25,
      "height": 0.21
    },
    "provenance": "weak_candidate",
    "verificationStatus": "PENDING",
    "reviewerId": null,
    "verifiedAt": null,
    "originalBoundingBox": null,
    "originalClassId": null,
    "reviewNotes": null,
    "trainingEligible": false
  },
  {
    "annotationId": "866eae04-5829-41c1-be30-dd0101c559af",
    "productId": "product_003",
    "imageId": "product_003_back",
    "source": "ocr_spatial_heuristic",
    "sourceLicense": "proprietary",
    "classId": 2,
    "className": "declaration_panel",
    "boundingBox": {
      "xCenter": 0.475,
      "yCenter": 0.455,
      "width": 0.25,
      "height": 0.21
    },
    "provenance": "weak_candidate",
    "verificationStatus": "PENDING",
    "reviewerId": null,
    "verifiedAt": null,
    "originalBoundingBox": null,
    "originalClassId": null,
    "reviewNotes": null,
    "trainingEligible": false
  },
  {
    "annotationId": "1c5a11ee-58c4-4bf5-9b63-fc9da551cd6a",
    "productId": "product_004",
    "imageId": "product_004_back",
    "source": "ocr_spatial_heuristic",
    "sourceLicense": "proprietary",
    "classId": 2,
    "className": "declaration_panel",
    "boundingBox": {
      "xCenter": 0.475,
      "yCenter": 0.455,
      "width": 0.25,
      "height": 0.21
    },
    "provenance": "weak_candidate",
    "verificationStatus": "PENDING",
    "reviewerId": null,
    "verifiedAt": null,
    "originalBoundingBox": null,
    "originalClassId": null,
    "reviewNotes": null,
    "trainingEligible": false
  },
  {
    "annotationId": "9deed0e9-4061-4787-9856-d95dd108408b",
    "productId": "product_005",
    "imageId": "product_005_back",
    "source": "ocr_spatial_heuristic",
    "sourceLicense": "proprietary",
    "classId": 2,
    "className": "declaration_panel",
    "boundingBox": {
      "xCenter": 0.475,
      "yCenter": 0.455,
      "width": 0.25,
      "height": 0.21
    },
    "provenance": "weak_candidate",
    "verificationStatus": "PENDING",
    "reviewerId": null,
    "verifiedAt": null,
    "originalBoundingBox": null,
    "originalClassId": null,
    "reviewNotes": null,
    "trainingEligible": false
  },
  {
    "annotationId": "a9b89100-e3a8-40c8-b142-0fcec008494f",
    "productId": "product_006",
    "imageId": "product_006_back",
    "source": "ocr_spatial_heuristic",
    "sourceLicense": "proprietary",
    "classId": 2,
    "className": "declaration_panel",
    "boundingBox": {
      "xCenter": 0.475,
      "yCenter": 0.455,
      "width": 0.25,
      "height": 0.21
    },
    "provenance": "weak_candidate",
    "verificationStatus": "PENDING",
    "reviewerId": null,
    "verifiedAt": null,
    "originalBoundingBox": null,
    "originalClassId": null,
    "reviewNotes": null,
    "trainingEligible": false
  },
  {
    "annotationId": "1ed0b45b-919a-4d6f-95e1-e831927a31b6",
    "productId": "product_007",
    "imageId": "product_007_back",
    "source": "ocr_spatial_heuristic",
    "sourceLicense": "proprietary",
    "classId": 2,
    "className": "declaration_panel",
    "boundingBox": {
      "xCenter": 0.475,
      "yCenter": 0.455,
      "width": 0.25,
      "height": 0.21
    },
    "provenance": "weak_candidate",
    "verificationStatus": "PENDING",
    "reviewerId": null,
    "verifiedAt": null,
    "originalBoundingBox": null,
    "originalClassId": null,
    "reviewNotes": null,
    "trainingEligible": false
  },
  {
    "annotationId": "2d729275-094e-49af-96bf-b0193a62d130",
    "productId": "product_008",
    "imageId": "product_008_back",
    "source": "ocr_spatial_heuristic",
    "sourceLicense": "proprietary",
    "classId": 2,
    "className": "declaration_panel",
    "boundingBox": {
      "xCenter": 0.475,
      "yCenter": 0.455,
      "width": 0.25,
      "height": 0.21
    },
    "provenance": "weak_candidate",
    "verificationStatus": "PENDING",
    "reviewerId": null,
    "verifiedAt": null,
    "originalBoundingBox": null,
    "originalClassId": null,
    "reviewNotes": null,
    "trainingEligible": false
  },
  {
    "annotationId": "8e7501da-b0e1-4594-a90d-9691ff0a5bb0",
    "productId": "product_009",
    "imageId": "product_009_back",
    "source": "ocr_spatial_heuristic",
    "sourceLicense": "proprietary",
    "classId": 2,
    "className": "declaration_panel",
    "boundingBox": {
      "xCenter": 0.475,
      "yCenter": 0.455,
      "width": 0.25,
      "height": 0.21
    },
    "provenance": "weak_candidate",
    "verificationStatus": "PENDING",
    "reviewerId": null,
    "verifiedAt": null,
    "originalBoundingBox": null,
    "originalClassId": null,
    "reviewNotes": null,
    "trainingEligible": false
  },
  {
    "annotationId": "7e746b80-a31e-4d04-b540-57e77eb33b98",
    "productId": "product_010",
    "imageId": "product_010_back",
    "source": "ocr_spatial_heuristic",
    "sourceLicense": "proprietary",
    "classId": 2,
    "className": "declaration_panel",
    "boundingBox": {
      "xCenter": 0.475,
      "yCenter": 0.455,
      "width": 0.25,
      "height": 0.21
    },
    "provenance": "weak_candidate",
    "verificationStatus": "PENDING",
    "reviewerId": null,
    "verifiedAt": null,
    "originalBoundingBox": null,
    "originalClassId": null,
    "reviewNotes": null,
    "trainingEligible": false
  }
]